{
 "event_id": 16794,
 "title": "Queen City Dance Festival 2026",
 "start_date": "2026-10-30",
 "read_by": "claude-opus-5-5 + claude-sonnet-5-5",
 "prompt": "cb864655c7075f56",
 "rows_at": "2026-10-27T11:39:33+00:00",
 "styles": [
  "bachata",
  "kizomba",
  "other",
  "salsa",
  "zouk"
 ],
 "description": "Queen City Dance Festival 2026\nJoin us in Charlotte, NC for the Queen City Dance Festival (QCDF) 2026, an exciting SBKZ festival bringing you the full experience of Salsa, Bachata, Kizomba, Konpa, Urbankiz, BZouk, Chicago Stepping, Detroit Ballroom and more!!!\nHeld at the Hilton Charlotte Airport, QCDF is going BIG for 2026! This four-day celebration of dance features some of the most talented artists and performers in the industry. Each day is filled with immersive workshops, inspiring performances, unforgettable day and night parties that keep the energy going into the early morning hours.\nOnce you experience the Queen City Dance Festival, it’s sure to become one of the premier dance events you look forward to each year in the vibrant Queen City!\nIf you’ve always wanted to learn how to dance, this is the perfect beginning. If you are looking to improve and advance your techniques, Queen City Dance Festival offers classes for beginners, challenges for the advanced, and everything in between. Come learn from the best in the world and our local community has to offer and enjoy the Queen City Dance Festival (QCDF) 2026!!\nQUEEN CITY DANCE FESTIVAL\n====================================\n4 Days of BEGINNER BOOTCAMPS (Salsa & Bachata, Kizomba & Konpa & Semba, Urbankiz & Zouk)\n4 Days of WORKSHOPS (For all levels, Beginners to Advanced)\n4 Nights of PERFORMANCES (Amateur to World Pro Dancers)\n4 Nights of Theme Parties till 5am!\n5 Dance rooms, each with a different style:\n* Salsa Room (Salsa, ChaChaCha, Timba, Mambo)\n* ⁠Bachata Room (Sensual & Dominican Bachata)\n* Kizomba/Konpa Room (Kizomba, Konpa, Semba, Afrohouse)\n* Urbankiz/BZouk Room (Ghetto-Zouk, Brazilian Zouk, Tarraxinha, and remixes with R&B)\n* ⁠Chicago Stepping/Detroit Ballroom (R&B, Soul, Jazz-funk, and Neo-soul)\n====================================\nPASSES AVAILABLE NOW\nBuy your passes before prices increase 😊💰\n🗓️: October 29 – November 2, 2026\n📍: Hilton Charlotte Airport Hotel\n🔗: For Passes 👇🏾\nhttps://tikamiproductions.com/queen-city-dance-festival/\n====================================\nARTISTS & DJs LINE UP\n🔥SALSA/BACHATA LINE UP🔥\n‼️ ARTISTS ‼️\nCARINE & RAFAEL\nFAUSTO & TAMARA\nTATY & LEO\nANA & GUGGIE\nRODRIGO & WENDY\nJENNIFER & EDUARDO\nAL & NIYA\nRANDI ROLLEN\nLORRAINE CRITTENDON\n‼️ DJs‼️\nDJ JULIO SABROSO\nDJ CARMONA\nDJ SONORO\nDJ JAY WEST\n🔥 KIZOMBA/KONPA LINE UP🔥\n‼️ ARTISTS ‼️\nELIZA SALA\nADILSON MAIZA\nSONY & JANELLE\nBRANDON & HAZEL\nVERONIKA & CLAUDE\nJAMES & EMMY\nASH THEO\n‼️ DJs‼️\nDJ SABURA\nDJ GUELAS\nDJ NS\nDJ SHAMS\n🔥CHICAGO STEPPING/DETROIT BALLROOM🔥\n‼️ ARTISTS ‼️\nDREWRY ALEXANDER\nCHOC JAMES\nDEMETRIUS JONES\nDEMOND CARTER\n‼️ DJs‼️\nDJ SHORTY SMOOTH\nDJ NEW WAVE\nDJ JAYCO\n🔥 URBANKIZ/ZOUK LINE UP🔥\n‼️ ARTISTS ‼️\nCEIJAY & BRUNA\nJERAMIE & ALYSSA\nHQ.DREW\nPAMELITA\nANNIE\nCARLKIZ\n‼️ DJs‼️\nDJ CASANOVA\nDJ YAWO\nDJ ALLETTA\nDon’t miss the chance to dance Salsa, Bachata, Kizomba, Konpa, Urbankiz, BZouk, Chicago Stepping, Detroit Ballroom and more at Queen City Dance Festival (QCDF) 2026 in Charlotte🔥🔥🤙🏾🤙🏾\nStay where the action happens and walk straight from your room to the dance floor for Social dancing, workshops and late-night vibes. Don’t wait, reserve your room now.\n📲 Fan Page: Queen City Dance Festival\n📲 Official event: https://www.facebook.com/events/865978169227273\n📲 QCDF Official Hotel Roommate Group:\nhttps://www.facebook.com/share/g/1AqCaPoU4H/?mibextid=wwXIfr\n📲 Website: https://tikamiproductions.com/queen-city-dance-festival/",
 "passes": [
  {
   "kind": "other",
   "style": null,
   "label_quote": null,
   "group_size": 1,
   "days": null,
   "includes_hotel": false,
   "tiers": [
    {
     "keys": [
      "64878"
     ],
     "from": null,
     "until": null,
     "quantity": null,
     "date_quote": null
    }
   ]
  },
  {
   "kind": "full",
   "style": null,
   "label_quote": null,
   "group_size": 1,
   "days": null,
   "includes_hotel": false,
   "tiers": [
    {
     "keys": [
      "64879"
     ],
     "from": null,
     "until": null,
     "quantity": null,
     "date_quote": null
    }
   ]
  },
  {
   "kind": "party",
   "style": null,
   "label_quote": null,
   "group_size": 1,
   "days": null,
   "includes_hotel": false,
   "tiers": [
    {
     "keys": [
      "64017"
     ],
     "from": null,
     "until": null,
     "quantity": null,
     "date_quote": null
    }
   ]
  },
  {
   "kind": "day",
   "style": null,
   "label_quote": null,
   "group_size": 1,
   "days": 1,
   "includes_hotel": false,
   "tiers": [
    {
     "keys": [
      "64018"
     ],
     "from": null,
     "until": null,
     "quantity": null,
     "date_quote": null
    }
   ]
  },
  {
   "kind": "day",
   "style": null,
   "label_quote": null,
   "group_size": 1,
   "days": 1,
   "includes_hotel": false,
   "tiers": [
    {
     "keys": [
      "64021"
     ],
     "from": null,
     "until": null,
     "quantity": null,
     "date_quote": null
    }
   ]
  },
  {
   "kind": "day",
   "style": null,
   "label_quote": null,
   "group_size": 1,
   "days": 1,
   "includes_hotel": false,
   "tiers": [
    {
     "keys": [
      "64022"
     ],
     "from": null,
     "until": null,
     "quantity": null,
     "date_quote": null
    }
   ]
  },
  {
   "kind": "day",
   "style": null,
   "label_quote": null,
   "group_size": 1,
   "days": 1,
   "includes_hotel": false,
   "tiers": [
    {
     "keys": [
      "64023"
     ],
     "from": null,
     "until": null,
     "quantity": null,
     "date_quote": null
    }
   ]
  },
  {
   "kind": "day",
   "style": null,
   "label_quote": null,
   "group_size": 1,
   "days": 1,
   "includes_hotel": false,
   "tiers": [
    {
     "keys": [
      "64024"
     ],
     "from": null,
     "until": null,
     "quantity": null,
     "date_quote": null
    }
   ]
  },
  {
   "kind": "day",
   "style": null,
   "label_quote": null,
   "group_size": 1,
   "days": 1,
   "includes_hotel": false,
   "tiers": [
    {
     "keys": [
      "64025"
     ],
     "from": null,
     "until": null,
     "quantity": null,
     "date_quote": null
    }
   ]
  },
  {
   "kind": "day",
   "style": null,
   "label_quote": null,
   "group_size": 1,
   "days": 1,
   "includes_hotel": false,
   "tiers": [
    {
     "keys": [
      "64026"
     ],
     "from": null,
     "until": null,
     "quantity": null,
     "date_quote": null
    }
   ]
  }
 ],
 "skipped": [
  {
   "key": "66622",
   "reason": "competition"
  },
  {
   "key": "66623",
   "reason": "competition"
  },
  {
   "key": "66624",
   "reason": "competition"
  }
 ],
 "rule_quotes": [
  "Buy your passes before prices increase"
 ]
}
