{
 "event_id": 18838,
 "title": "Hot Tropical Dance Festival 2027",
 "start_date": "2027-04-08",
 "read_by": "claude-opus-5-5 + claude-sonnet-5-5",
 "prompt": "1a3b603636d758ee",
 "rows_at": "2026-10-27T18:40:31+00:00",
 "styles": [
  "bachata",
  "kizomba",
  "salsa"
 ],
 "description": "Welcome to the next evolution of the 𝗛𝗢𝗧 𝗧𝗥𝗢𝗣𝗜𝗖𝗔𝗟 𝗗𝗔𝗡𝗖𝗘 𝟮𝟬𝟮𝟳!!!🌴☀️🔥\n🎟𝗙𝘂𝗹𝗹 𝗽𝗮𝘀𝘀:\nhttps://www.goandance.com/…/hot-tropical-dance-malaga-2027\n📲𝗘𝘃𝗲𝗻𝘁:\nhttps://facebook.com/events/s/hot-tropical-dance-festival-20/2002017800735419/\n🔸️𝘽𝘼𝘾𝙃𝘼𝙏𝘼🔸️\n𝙏𝙚𝙖𝙘𝙝𝙚𝙧𝙨\n✅️Melvin & Gatica\n✅️Kike & Nahir\n✅️Alfredo & Andrea\n✅️Miguel & Sunsire\n✅️Nacho & Silvia\n✅️David & Inés\n✅️Andrés & Yessica\n✅️Eduard & María\n✅️Sergio & Elena\n✅️Emilien & Tehina\n✅️Jorge & Azahara\n✅️Jesús & Maribel\n✅️Daimy & Valeria\n✅️Javi & Fuensi\n✅️Francesco & Debora\n𝘿𝙅𝙎\n✅️DJ Khalid\n✅️DJ Pecino\n✅️DJ Dimen5ions\n✅️DJ Killo\n✅️DJ One\n✅️DJ Maky\n✅️DJ Kevin RG\n🔸️𝙎𝘼𝙇𝙎𝘼🔸️\n𝙏𝙚𝙖𝙘𝙝𝙚𝙧𝙨\n✅️Jorge & Indira\n✅️Jose & María\n✅️Charlie & Vero\n✅️Irene & Noelia\n✅️Javi & Fuensi\n𝘿𝙅𝙎\n✅️DJ Killo\n✅️DJ Kevin RG\n🔹️𝙆𝙄𝙕𝙊𝙈𝘽𝘼 & 𝙐𝙍𝘽𝘼𝙉𝙆𝙄𝙕🔹️\n𝙏𝙚𝙖𝙘𝙝𝙚𝙧𝙨\n✅️Jesús & Anni\n✅️Dwe & Gaby\n✅️Fabrizio dozangado\n✅️Marcio\n✅️Melania\n✅️Said Dstreet\n✅️Malick & Carla\n✅️Endos & Dorian\n✅️Radu & Judit\n✅️Trésor & Aurea\n✅️Dadié\n✅️Justinho\n✅️Massemba\n✅️Nelson & Araceli\n✅️Javi & Fuensi\n𝘿𝙅𝙎\n✅️DJ Dani\n✅️DJ Lisa\n✅️DJ Paraïso\n✅️DJ Shark\n✅️DJ Lucas\n✅️DJ Poema\n✅️DJ Marto\n✅️DJ Rido\n✅️DJ Loka\n✅️DJ Tegs\n❤‍🔥𝗧𝗛𝗘 𝗕𝗘𝗦𝗧 𝗢𝗥 𝗡𝗢𝗧𝗛𝗜𝗡𝗚❤‍🔥\n𝑩𝒚 𝑻𝒆𝒎𝒑𝒕𝒂𝒕𝒊𝒐𝒏 𝑭𝒆𝒔𝒕𝒊𝒗𝒂𝒍.",
 "passes": [
  {
   "kind": "full",
   "style": null,
   "label_quote": null,
   "group_size": 1,
   "days": 3,
   "includes_hotel": false,
   "tiers": [
    {
     "keys": [
      "656f4137-4b6c-4ea5-bef8-ecf830bc68b7",
      "f8186cd0-d822-4aae-9d0f-eae171993b3b"
     ],
     "from": null,
     "until": null,
     "quantity": null,
     "date_quote": null
    }
   ]
  },
  {
   "kind": "full",
   "style": null,
   "label_quote": null,
   "group_size": 1,
   "days": 4,
   "includes_hotel": false,
   "tiers": [
    {
     "keys": [
      "8c16ef99-b445-4a51-8486-0b11e7375a04",
      "049e57be-da58-4c27-b506-46e48f6d4b24"
     ],
     "from": null,
     "until": null,
     "quantity": null,
     "date_quote": null
    }
   ]
  },
  {
   "kind": "other",
   "style": null,
   "label_quote": null,
   "group_size": 1,
   "days": 3,
   "includes_hotel": false,
   "tiers": [
    {
     "keys": [
      "8854b167-69a9-42ea-8bba-6039e6a8ac29",
      "b613cf22-1d80-467c-9555-a382f1127e91"
     ],
     "from": null,
     "until": null,
     "quantity": null,
     "date_quote": null
    }
   ]
  }
 ],
 "skipped": [],
 "rule_quotes": []
}
